{
  "contract_type": "speckit.implement.manifest.v1",
  "run_id": "run-002",
  "feature_path": "specs/002-docs-poc",
  "context_index_path": "specs/002-docs-poc/context-index.json",
  "execution_mode": "manual_fresh_worker_session",
  "planner_outputs": [
    {
      "vertical_capability": "documentation",
      "planner_id": "planner-documentation-01",
      "shard_plan_path": "handoffs/implement/run-002/planner-outputs/planner-documentation-01/shard-plan.md",
      "handoff_draft_paths": [
        "handoffs/implement/run-002/S01-documentation-01/handoff.json",
        "handoffs/implement/run-002/S02-documentation-01/handoff.json",
        "handoffs/implement/run-002/S03-documentation-01/handoff.json"
      ],
      "context_digest_draft_paths": [
        "handoffs/implement/run-002/S01-documentation-01/context-digest.md",
        "handoffs/implement/run-002/S02-documentation-01/context-digest.md",
        "handoffs/implement/run-002/S03-documentation-01/context-digest.md"
      ]
    },
    {
      "vertical_capability": "integration",
      "planner_id": "planner-integration-01",
      "shard_plan_path": "handoffs/implement/run-002/planner-outputs/planner-integration-01/shard-plan.md",
      "handoff_draft_paths": [
        "handoffs/implement/run-002/S04-integration-01/handoff.json",
        "handoffs/implement/run-002/S05-integration-01/handoff.json"
      ],
      "context_digest_draft_paths": [
        "handoffs/implement/run-002/S04-integration-01/context-digest.md",
        "handoffs/implement/run-002/S05-integration-01/context-digest.md"
      ]
    }
  ],
  "shards": [
    {
      "shard_id": "S01-documentation-01",
      "handoff_path": "handoffs/implement/run-002/S01-documentation-01/handoff.json",
      "context_digest_path": "handoffs/implement/run-002/S01-documentation-01/context-digest.md",
      "receipt_path": "handoffs/implement/run-002/S01-documentation-01/results/receipt.json",
      "task_ids": ["T001", "T002", "T003"],
      "vertical_capability": "documentation"
    },
    {
      "shard_id": "S02-documentation-01",
      "handoff_path": "handoffs/implement/run-002/S02-documentation-01/handoff.json",
      "context_digest_path": "handoffs/implement/run-002/S02-documentation-01/context-digest.md",
      "receipt_path": "handoffs/implement/run-002/S02-documentation-01/results/receipt.json",
      "task_ids": ["T005", "T007", "T008", "T012b"],
      "vertical_capability": "documentation"
    },
    {
      "shard_id": "S03-documentation-01",
      "handoff_path": "handoffs/implement/run-002/S03-documentation-01/handoff.json",
      "context_digest_path": "handoffs/implement/run-002/S03-documentation-01/context-digest.md",
      "receipt_path": "handoffs/implement/run-002/S03-documentation-01/results/receipt.json",
      "task_ids": ["T009", "T010", "T011", "T012"],
      "vertical_capability": "documentation"
    },
    {
      "shard_id": "S04-integration-01",
      "handoff_path": "handoffs/implement/run-002/S04-integration-01/handoff.json",
      "context_digest_path": "handoffs/implement/run-002/S04-integration-01/context-digest.md",
      "receipt_path": "handoffs/implement/run-002/S04-integration-01/results/receipt.json",
      "task_ids": ["T013", "T014"],
      "vertical_capability": "integration"
    },
    {
      "shard_id": "S05-integration-01",
      "handoff_path": "handoffs/implement/run-002/S05-integration-01/handoff.json",
      "context_digest_path": "handoffs/implement/run-002/S05-integration-01/context-digest.md",
      "receipt_path": "handoffs/implement/run-002/S05-integration-01/results/receipt.json",
      "task_ids": ["T004", "T006", "T015", "T016"],
      "vertical_capability": "integration"
    }
  ],
  "dependencies": [
    {
      "shard_id": "S01-documentation-01",
      "depends_on": []
    },
    {
      "shard_id": "S02-documentation-01",
      "depends_on": ["S01-documentation-01"]
    },
    {
      "shard_id": "S03-documentation-01",
      "depends_on": ["S01-documentation-01"]
    },
    {
      "shard_id": "S04-integration-01",
      "depends_on": ["S01-documentation-01", "S02-documentation-01", "S03-documentation-01"]
    },
    {
      "shard_id": "S05-integration-01",
      "depends_on": ["S01-documentation-01", "S02-documentation-01", "S03-documentation-01", "S04-integration-01"]
    }
  ],
  "dispatch_order": [
    ["S01-documentation-01"],
    ["S02-documentation-01", "S03-documentation-01"],
    ["S04-integration-01"],
    ["S05-integration-01"]
  ]
}